PAINEL DE STATUS DA FROTA;;;;;;;;
Cavalo;Prancha;Motorista;Localização;Destino;Status;Km rodado;Cliente;Observação
CVM-001;PB-001;Danilo Almeida;Atibaia/SP;Pouso Alegre/MG;Carregado;0km;XCMG;Retido para averiguar AET e carga pela PRF- 120km do destino
CVM-002;PB-002;Manoel Nilo;Pouso Alegre/MG;Pouso Alegre/MG;Ag. Descarregar;127km;XCMG;Aguardando para realizar entrega na XCMG
CVM-003;PB-003;Josevaldo José;Pouso Alegre/MG;Pouso Alegre/MG;Ag. Descarregar;158km;XCMG;Aguardando para realizar entrega na XCMG
CVM-004;;Dorgival Silva;Cascavel/PR;Curitiba/SP;Manutenção;0km;;Na Scania para diagnóstico e correção de falha no cavalo
